<?xml version="1.0" encoding="UTF-8" ?>
<people xmlns="http://example.com/XMLProject"
        xmlns:xsi="http://www.w3.org/2001/XMLSchema-instance"
        xsi:schemaLocation="http://example.com/XMLProject CheckedByThePolice.xsd">

       <person id_number="682593234" id_date_of_issue="2008-12-15"
               id_expiry="2018-12-15" id_issued_by="МВР Пловдив" signature="true">
           <first_name>Петър</first_name>
           <fathers_name>Георгиев</fathers_name>
           <surname>Петров</surname>
           <personal_NO>9011246532</personal_NO>
           <sex>Мъж</sex>
           <eyes_color>Кафяви</eyes_color>
           <height>178</height>
           <date_of_birth>1990-11-24</date_of_birth>
           <nationality>България</nationality>
           <place_of_birth>Пловдив</place_of_birth>
           <residence>Пловдив</residence>
           <more_person_info>
               <phone>0892322265</phone>
               <email>petar-petrov@gmail.com</email>
           </more_person_info>
           <close_person>
               <phone>0892323266</phone>
               <email>petar@gmail.com</email>
           </close_person>
           <times_checked>
               <times>4</times>
               <this_month>true</this_month>
           </times_checked>
           <criminal_acts isCriminal="false"></criminal_acts>
       </person>

       <person id_number="682593235" id_date_of_issue="2012-10-15"
               id_expiry="2022-10-15" id_issued_by="МВР Стара Загора" signature="true">
           <first_name>Мира</first_name>
           <fathers_name>Георгиева</fathers_name>
           <surname>Ангелива</surname>
           <personal_NO>9409106533</personal_NO>
           <sex>Жена</sex>
           <eyes_color>Сини</eyes_color>
           <height>165</height>
           <date_of_birth>1994-09-10</date_of_birth>
           <nationality>България</nationality>
           <place_of_birth>Стара Загора</place_of_birth>
           <residence>София</residence>
           <more_person_info>
               <phone>0892566511</phone>
               <email>mira_angelova@gmail.com</email>
           </more_person_info>
           <close_person>
               <phone>0892566423</phone>
               <email>mira@gmail.com</email>
           </close_person>
           <times_checked>
               <times>2</times>
               <this_month>true</this_month>
           </times_checked>
           <criminal_acts isCriminal="false"></criminal_acts>
       </person>
</people>
